external_id,full_details,type,purchase_price_eur,sales_price_eur
v.14538.2015.b,"Rudi Pichler, Riesling Smaragd Achleithen, 2015, 750 ml",WHITE,,125.00
v.14538.2019.b,"Rudi Pichler, Riesling Smaragd Achleithen, 2019, 750 ml",WHITE,,102.00
v.507.1993.b,"Ruffino, Cabreo Il Borgo, 1993, 750 ml",RED,,120.00
v.6527.2005.c,"Ruffino, Modus, 2005, 1500 ml",RED,,180.00
v.5747.2000.d,"Ruffino, Romitorio di Santedame, 2000, 3000 ml",RED,,340.00
v.33307.0.b,"Ruinart, Blanc de Blancs Brût, 750 ml",WHITE,,166.00
v.10910.0.b,"Ruinart, Brut, 750 ml",WHITE,,110.00
v.1580.0.b,"Ruinart, Rosé Brût, 750 ml",,,166.00
v.72108.2019.b,"Salwey, Spätburgunder Oberrotweil RS, 2019, 750 ml",RED,,54.00
v.440.2022.b,"San Giusto a Rentennano, Chianti Classico, 2022, 750 ml",RED,,37.00
v.12709.2021.b,"Schäfer-Fröhlich, Riesling Trocken Bockenauer Schiefergestein, 2021, 750 ml",WHITE,,66.00
v.14453.2021.b,"Schäfer-Fröhlich, Riesling Trocken Vulkangestein, 2021, 750 ml",WHITE,,62.00
v.68512.2022.b,"Schinterhof, Pinot grigio, 2022, 750 ml",WHITE,,43.00
v.90479.2021.b,"Schinterhof, Sauvignon blanc, 2021, 750 ml",WHITE,,65.00
v.82571.2022.b,"Seeperle, Alto Adige Gewürztraminer Scharf, 2022, 750 ml",WHITE,,37.00
v.100815.2023.b,"Seeperle, Kalterersee Classico Superiore Arthur Rainer, 2023, 750 ml",RED,17.00,41.00
v.100756.2023.b,"Seeperle, Sauvignon blanc Echt geil, 2023, 750 ml",WHITE,,36.00
v.33163.2019.b,"Sorentberg, Riesling Rotschiefer vom 1000 Alte Reben, 2019, 750 ml",WHITE,60.00,110.00
v.30322.2023.b,"Sorentberg, Riesling Rotschiefer, 2023, 750 ml",WHITE,,45.00
v.103475.2022.b,"Spitalerhof, Lagrein Dunkel Not Always, 2022, 750 ml",RED,24.00,53.00
v.103478.2023.b,"Spitalerhof, Sylvaner Sepp's Alte Rebe, 2023, 750 ml",WHITE,12.00,35.00
v.109236.2022.b,"Steflhof, Cabernet sauvignon Riserva Stefan, 2022, 750 ml",RED,27.00,56.00
v.100721.2023.b,"Steflhof, Chardonnay Am Kies, 2023, 750 ml",WHITE,13.50,37.00
v.109235.2023.b,"Steflhof, Kalterersee Classico Superiore Eduard, 2023, 750 ml",RED,13.00,35.00
v.100817.2021.c,"Steflhof, Lagrein Riserva, 2021, 1500 ml",RED,,98.00
v.100817.2021.b,"Steflhof, Lagrein Riserva, 2021, 750 ml",RED,32.00,46.00
v.100816.2020.b,"Steflhof, Vernatsch Pergel in Aquarell, 2020, 750 ml",RED,21.00,37.00
v.5757.2023.b,"Stroblhof, Pinot bianco Strahler, 2023, 750 ml",WHITE,,36.00
v.7329.2022.b,"Stroblhof, Pinot nero Pigeno, 2022, 750 ml",RED,,45.00
v.4874.2017.c,"Stroblhof, Pinot noir Riserva, 2017, 1500 ml",RED,,140.00
v.4874.2020.b,"Stroblhof, Pinot noir Riserva, 2020, 750 ml",RED,,73.00
v.63587.2023.b,"Tauber, Kerner, 2023, 750 ml",WHITE,,36.00
v.100755.2021.c,"Tauber, Riesling, 2021, 1500 ml",WHITE,,92.00
v.100755.2022.b,"Tauber, Riesling, 2022, 750 ml",WHITE,,44.00
v.54740.2023.b,"Tauber, Sylvaner, 2023, 750 ml",WHITE,,36.00
v.82032.2021.b,"Tement, Sauvignon blanc Ried Grassnitzberg Riff, 2021, 750 ml",WHITE,29.00,64.00
v.87228.2021.b,"Tenuta Campo al Mare, Bolgheri Superiore Baia al Vento, 2021, 750 ml",RED,,74.00
v.8655.2022.c,"Tenuta Campo di Sasso, Insoglio del Cinghiale, 2022, 1500 ml",RED,,90.00
v.8655.2023.b,"Tenuta Campo di Sasso, Insoglio del Cinghiale, 2023, 750 ml",RED,,44.00
v.100606.2021.b,"Tenuta Casòn Hirschprunn, Cason Hirschprunn Bianco, 2021, 750 ml",WHITE,28.00,78.00
v.3666.2017.b,"Tenuta di Biserno, Biserno, 2017, 750 ml",RED,,165.00
v.3666.2018.b,"Tenuta di Biserno, Biserno, 2018, 750 ml",RED,,165.00
v.3667.2021.b,"Tenuta di Biserno, Il Pino di Biserno, 2021, 750 ml",RED,,75.00
v.12702.2021.b,"Tenuta di Nozzole, Chianti Classico Riserva La Forra, 2021, 750 ml",RED,,44.00
v.458.2019.b,"Tenuta di Nozzole, Il Pareto, 2019, 750 ml",RED,,88.00
v.354.2018.b,"Tenuta Fontodi, Flaccianello della Pieve, 2018, 750 ml",RED,,146.00
v.45995.2023.b,"Tenuta I Fauri, Pecorino d'Abruzzo, 2023, 750 ml",WHITE,,34.00
v.1760.2014.b,"Tenuta le Potazzine, Brunello di Montalcino, 2014, 750 ml",RED,,93.00
v.314.1997.b,"Tenuta Masseto, Masseto, 1997, 750 ml",RED,,"1,900.00"
v.314.2002.b,"Tenuta Masseto, Masseto, 2002, 750 ml",RED,,"1,600.00"
v.314.2003.b,"Tenuta Masseto, Masseto, 2003, 750 ml",RED,,"1,550.00"
v.314.2012.b,"Tenuta Masseto, Masseto, 2012, 750 ml",RED,,"1,300.00"
v.9195.2022.c,"Tenuta Mayr-Unterganzner, Composition Reif, 2022, 1500 ml",RED,,160.00
v.9195.2022.b,"Tenuta Mayr-Unterganzner, Composition Reif, 2022, 750 ml",RED,,76.00
v.50880.2024.b,"Tenuta Mayr-Unterganzner, Lagrein Kretzer, 2024, 750 ml",,10.00,35.00
v.9196.2023.b,"Tenuta Mayr-Unterganzner, Lamarein, 2023, 750 ml",RED,50.00,110.00
v.62151.2022.b,"Tenuta Nicolussi-Leck, Gewürztraminer 1990 Stephanie, 2022, 750 ml",WHITE,,38.00
v.44597.2023.b,"Tenuta San Francesco, Costa d'Amalfi Bianco Clandestino Nature, 2023, 750 ml",WHITE,20.00,49.00
v.365.1994.b,"Tenuta San Guido, Bolgheri Sassicaia, 1994, 750 ml",RED,,530.00
v.365.1995.c,"Tenuta San Guido, Bolgheri Sassicaia, 1995, 1500 ml",RED,,"1,200.00"
v.365.1995.b,"Tenuta San Guido, Bolgheri Sassicaia, 1995, 750 ml",RED,,520.00
v.365.1996.b,"Tenuta San Guido, Bolgheri Sassicaia, 1996, 750 ml",RED,,490.00
v.365.1997.b,"Tenuta San Guido, Bolgheri Sassicaia, 1997, 750 ml",RED,,460.00
v.365.1999.b,"Tenuta San Guido, Bolgheri Sassicaia, 1999, 750 ml",RED,,435.00
v.365.2000.b,"Tenuta San Guido, Bolgheri Sassicaia, 2000, 750 ml",RED,,420.00
v.365.2005.b,"Tenuta San Guido, Bolgheri Sassicaia, 2005, 750 ml",RED,,380.00
v.365.2007.b,"Tenuta San Guido, Bolgheri Sassicaia, 2007, 750 ml",RED,,400.00
v.365.2013.b,"Tenuta San Guido, Bolgheri Sassicaia, 2013, 750 ml",RED,,400.00
v.365.2014.b,"Tenuta San Guido, Bolgheri Sassicaia, 2014, 750 ml",RED,,390.00
v.365.1992.b,"Tenuta San Guido, Sassicaia, 1992, 750 ml",RED,,550.00
v.365.1993.b,"Tenuta San Guido, Sassicaia, 1993, 750 ml",RED,,535.00
v.1324.2018.b,"Tenuta San Leonardo, San Leonardo, 2018, 750 ml",RED,,105.00
v.1323.2019.b,"Tenuta San Leonardo, Villa Gresti, 2019, 750 ml",RED,,46.00
v.53841.2019.b,"Tenuta Sette Cieli, Indaco, 2019, 750 ml",RED,,72.00
v.13293.2017.b,"Tenuta Valdicava, Brunello di Montalcino, 2017, 750 ml",RED,,88.00
v.76836.2021.b,"Tenuta Valdicava, Rosso di Montalcino, 2021, 750 ml",RED,,48.00
v.6422.1994.b,"Tenute del Cabreo, Cabreo Il Borgo, 1994, 750 ml",RED,,115.00
v.6422.2016.c,"Tenute del Cabreo, Cabreo Il Borgo, 2016, 1500 ml",RED,,155.00
v.6422.2016.d,"Tenute del Cabreo, Cabreo Il Borgo, 2016, 3000 ml",RED,,310.00
v.6422.2020.b,"Tenute del Cabreo, Cabreo Il Borgo, 2020, 750 ml",RED,,72.00
v.1363.2016.b,"Terre del Sillabo, Merlot Niffo, 2016, 750 ml",RED,,52.00
v.3914.0.b,"Thiénot, Brut, 750 ml",WHITE,,84.00
v.42718.2023.b,"Thomas Dorfmann, Gewürztraminer, 2023, 750 ml",WHITE,,38.00
v.42717.2023.b,"Thomas Dorfmann, Riesling, 2023, 750 ml",WHITE,,38.00
v.61965.2022.b,"Thomas Dorfmann, Sylvaner, 2022, 750 ml",WHITE,12.00,36.00
v.37565.2021.b,"Thurnhof, Weinegg, 2021, 750 ml",RED,,46.00
v.30895.2022.b,"Tiefenbrunner, Cabernet sauvignon Turmhof, 2022, 750 ml",RED,15.50,37.00
v.14796.2014.b,"Tiefenbrunner, Chardonnay Riserva Vigna Au, 2014, 750 ml",WHITE,60.00,137.00
v.14796.2015.b,"Tiefenbrunner, Chardonnay Riserva Vigna Au, 2015, 750 ml",WHITE,60.00,125.00
v.14796.2017.b,"Tiefenbrunner, Chardonnay Riserva Vigna Au, 2017, 750 ml",WHITE,60.00,117.00
v.14796.2018.b,"Tiefenbrunner, Chardonnay Riserva Vigna Au, 2018, 750 ml",WHITE,60.00,111.00
v.14796.2019.b,"Tiefenbrunner, Chardonnay Riserva Vigna Au, 2019, 750 ml",WHITE,60.00,103.00
v.14796.2020.b,"Tiefenbrunner, Chardonnay Riserva Vigna Au, 2020, 750 ml",WHITE,,95.00
v.76660.2016.m,"Tiefenbrunner, Feldmarschall von Fenner Vendemmia Tardiva, 2016, 500 ml",WHITE,,125.00
v.30888.2020.b,"Tiefenbrunner, Linticlarus Cuvée Riserva, 2020, 750 ml",RED,,70.00
v.6712.2020.b,"Tiefenbrunner, Müller Thurgau Vigna Feldmarschall von Fenner, 2020, 750 ml",WHITE,,70.00
v.14797.2014.b,"Tiefenbrunner, Sauvignon blanc Riserva Vigna Rachtl, 2014, 750 ml",WHITE,55.00,140.00
v.14797.2016.c,"Tiefenbrunner, Sauvignon blanc Riserva Vigna Rachtl, 2016, 1500 ml",WHITE,,250.00
v.14797.2016.b,"Tiefenbrunner, Sauvignon blanc Riserva Vigna Rachtl, 2016, 750 ml",WHITE,55.00,120.00
v.14797.2017.c,"Tiefenbrunner, Sauvignon blanc Riserva Vigna Rachtl, 2017, 1500 ml",WHITE,,240.00
v.14797.2018.u,"Tiefenbrunner, Sauvignon blanc Riserva Vigna Rachtl, 2018, 1500 ml",WHITE,,220.00
v.14797.2018.b,"Tiefenbrunner, Sauvignon blanc Riserva Vigna Rachtl, 2018, 750 ml",WHITE,55.00,105.00
v.14797.2020.b,"Tiefenbrunner, Sauvignon blanc Riserva Vigna Rachtl, 2020, 750 ml",WHITE,55.00,90.00
v.14797.2021.b,"Tiefenbrunner, Sauvignon blanc Riserva Vigna Rachtl, 2021, 750 ml",WHITE,,83.00
v.14797.2022.b,"Tiefenbrunner, Sauvignon blanc Riserva Vigna Rachtl, 2022, 750 ml",WHITE,48.00,83.00
v.64169.2023.b,"Tormaresca, Furia di Calafuria, 2023, 750 ml",,,39.00
v.68089.2018.b,"Trediberri, Barolo del Comune di La Morra, 2018, 750 ml",RED,,77.00
v.51509.1988.b,"Trevisiol, Metodo Classico Evoluzione Nature Brût, 1988, 750 ml",WHITE,,111.00
v.54030.2018.b,"Uccelliera, Brunello di Montalcino, 2018, 750 ml",RED,45.00,96.00
v.94870.2021.b,"Untermoserhof - Georg & Florian Ramoser, Lagrein Riserva, 2021, 750 ml",RED,,56.00
v.421.2016.c,"Val di Suga, Brunello di Montalcino Vigna Spuntali, 2016, 1500 ml",RED,,180.00
v.66308.0.b,"Valentin Leflaive, CV|17|50 Blanc de Blancs Extra brût, 750 ml",WHITE,,108.00
v.66896.0.b,"Valentin Leflaive, Le Mesnil sur Oger |16|50 Blanc de Blancs Extra brût Grand Cru, 750 ml",WHITE,,158.00
v.78154.2016.b,"Vegliamonte, Alba, 2016, 750 ml",RED,,62.00
v.13708.2015.c,"Vespa, Nero di Troia Helena, 2015, 1500 ml",RED,,190.00
v.11504.0.b,"Veuve Clicquot-Ponsardin, Cuvée Saint-Pétersbourg Brût, 750 ml",WHITE,,97.00
v.91694.0.b,"Veuve Clicquot-Ponsardin, Extra Old 4 Extra brût (dég. 02/2023), 750 ml",WHITE,60.00,119.00
v.67657.0.b,"Veuve Fourny & Fils, Grands Terroirs Brût 1er Cru, 750 ml",WHITE,,73.00
v.6892.2018.b,"Vietti, Barolo Castiglione, 2018, 750 ml",RED,,74.00
v.89806.2020.b,"VignaMadre - Famiglia Di Carlo, Apoteo  Rosso, 2020, 750 ml",RED,,61.00
v.89807.2019.b,"VignaMadre - Famiglia Di Carlo, Montepulciano d'Abruzzo Capo Le Vigne, 2019, 750 ml",RED,,37.00
v.105861.2022.b,"Wildmonn, Chardonnay Riserva, 2022, 750 ml",WHITE,40.00,90.00
v.30803.2018.b,"Wildmonn, Pinot noir Riserva, 2018, 750 ml",RED,,106.00
v.30803.2019.b,"Wildmonn, Pinot noir Riserva, 2019, 750 ml",RED,,99.00
v.30803.2020.b,"Wildmonn, Pinot noir Riserva, 2020, 750 ml",RED,,95.00
v.30803.2021.b,"Wildmonn, Pinot noir Riserva, 2021, 750 ml",RED,50.00,95.00
v.107118.0.b,"Winkler, Fondatore Pas dosé, 750 ml",WHITE,98.00,185.00
v.60761.0.c,"Winkler, Lamm N.12 Extra brût, 1500 ml",WHITE,,155.00
v.60761.0.b,"Winkler, Lamm N.12 Extra brût, 750 ml",WHITE,,70.00
v.14375.2021.b,"Wittmann, Riesling Trocken Morstein GG, 2021, 750 ml",WHITE,,118.00
v.3640.2024.b,"Zenato - Tenuta S. Cristina, Lugana, 2024, 750 ml",WHITE,,34.00
v.31381.2024.b,"Zenato, Bardolino Chiaretto, 2024, 750 ml",,,34.00
v.3831.2020.b,"Zenato, Valpolicella Ripasso Superiore Ripassa, 2020, 750 ml",RED,,38.00
v.97937.2023.b,"Zöhlhof, Müller Thurgau, 2023, 750 ml",WHITE,12.00,36.00
