external_id,full_details,type,purchase_price_eur,sales_price_eur
v.48580.1998.b,"Giuseppe Contratto, Barolo Cerequio, 1998, 750 ml",RED,,140.00
v.48179.2020.b,"Gorelli, Rosso di Montalcino, 2020, 750 ml",RED,,63.00
v.400.2005.b,"Grattamacco, Bolgheri Rosso Superiore, 2005, 750 ml",RED,,160.00
v.400.2018.b,"Grattamacco, Bolgheri Rosso Superiore, 2018, 750 ml",RED,,155.00
v.30876.2021.b,"Grattamacco, Bolgheri Rosso, 2021, 750 ml",RED,78.60,150.00
v.62205.2023.b,"Griesbauerhof, Lagrein, 2023, 750 ml",RED,12.00,36.00
v.16422.2022.b,"Guado al Melo, Bolgheri Rute, 2022, 750 ml",RED,,36.00
v.16423.2021.b,"Guado al Melo, Bolgheri Superiore Atis, 2021, 750 ml",RED,,72.00
v.236.2023.b,"Guado al Tasso - Antinori, Bolgheri Rosso Il Bruciato, 2023, 750 ml",RED,,46.00
v.235.1998.b,"Guado al Tasso - Antinori, Bolgheri Superiore Guado al Tasso, 1998, 750 ml",RED,,210.00
v.235.1999.b,"Guado al Tasso - Antinori, Bolgheri Superiore Guado al Tasso, 1999, 750 ml",RED,,210.00
v.235.2004.b,"Guado al Tasso - Antinori, Bolgheri Superiore Guado al Tasso, 2004, 750 ml",RED,,200.00
v.235.2005.b,"Guado al Tasso - Antinori, Bolgheri Superiore Guado al Tasso, 2005, 750 ml",RED,,200.00
v.235.2007.b,"Guado al Tasso - Antinori, Bolgheri Superiore Guado al Tasso, 2007, 750 ml",RED,,190.00
v.235.2008.b,"Guado al Tasso - Antinori, Bolgheri Superiore Guado al Tasso, 2008, 750 ml",RED,,190.00
v.235.2021.b,"Guado al Tasso - Antinori, Bolgheri Superiore Guado al Tasso, 2021, 750 ml",RED,100.00,172.00
v.6027.2022.b,"Gump Hof, Gewürztraminer Praesulis, 2022, 750 ml",WHITE,,35.00
v.34082.2021.b,"Gump Hof, Weissburgunder Riserva Renaissance, 2021, 750 ml",WHITE,30.00,65.00
v.71863.2018.b,"Harmand Geoffroy, Gevrey-Chambertin La Bossiere Monopole 1er Cru, 2018, 750 ml",RED,,142.00
v.101767.2020.b,"Hees, Riesling Spätlese Auener Römerstich, 2020, 750 ml",WHITE,28.00,62.00
v.100768.2022.b,"Hees, Riesling Steingewann, 2022, 750 ml",WHITE,,35.00
v.15460.2022.b,"Henri Bourgeois, Sancerre Blanc La Bourgeoise ES-56, 2022, 750 ml",WHITE,,68.00
v.1638.0.b,"Huré-Frères, Invitation Brût, 750 ml",WHITE,40.00,98.00
v.13478.2017.b,"I Collazzi, Ferro, 2017, 750 ml",RED,,119.00
v.14202.2018.c,"Ignaz Niedrist, Blauburgunder Riserva, 2018, 1500 ml",RED,,130.00
v.14202.2020.b,"Ignaz Niedrist, Blauburgunder Riserva, 2020, 750 ml",RED,,70.00
v.10225.2021.b,"Ignaz Niedrist, Lagrein Riserva Gries Berger Gei, 2021, 750 ml",RED,,56.00
v.31045.2023.b,"Ignaz Niedrist, Sauvignon Porphyr & Kalk, 2023, 750 ml",WHITE,,40.00
v.451.2018.b,"Isole e Olena, Cepparello, 2018, 750 ml",RED,70.00,140.00
v.5585.2021.b,"J. Hofstätter, Gewürztraminer Vigna Kolbenhof, 2021, 750 ml",WHITE,,62.00
v.8258.2019.b,"J. Hofstätter, Lagrein Steinraffler Vigna, 2019, 750 ml",RED,28.00,65.00
v.14414.2023.b,"J. Hofstätter, Rosé, 2023, 750 ml",,,35.00
v.100820.2020.b,"Jean-Baptiste Jessiaume, Santenay Rouge Les Gravières 1er Cru, 2020, 750 ml",RED,,86.00
v.1167.2020.c,"Jermann, Vintage Tunina, 2020, 1500 ml",WHITE,,180.00
v.1167.2021.b,"Jermann, Vintage Tunina, 2021, 750 ml",WHITE,,90.00
v.3422.2020.b,"Jermann, W ... Dreams …, 2020, 750 ml",WHITE,45.00,90.00
v.100814.2016.b,"Kandlerhof, Magdalena, 2016, 750 ml",RED,19.00,44.00
v.100781.0.b,"Kandlerhof, Mirum, 750 ml",RED,26.00,63.00
v.71819.2022.b,"Kellerei Girlan, Cabernet Merlot Riserva Cuvée Flora, 2022, 750 ml",RED,18.00,46.00
v.33598.2023.b,"Kellerei Girlan, Chardonnay Flora, 2023, 750 ml",WHITE,,46.00
v.71502.2020.b,"Kellerei Girlan, Chardonnay Riserva Curlan, 2020, 750 ml",WHITE,,114.00
v.100787.2020.b,"Kellerei Girlan, Cuvée Hanna, 2020, 750 ml",RED,,38.00
v.100787.2021.b,"Kellerei Girlan, Cuvée Noah, 2021, 750 ml",RED,,38.00
v.14321.2022.c,"Kellerei Girlan, Laurin Lagrein Merlot, 2022, 1500 ml",RED,,75.00
v.14321.2022.d,"Kellerei Girlan, Laurin Lagrein Merlot, 2022, 3000 ml",RED,,155.00
v.14321.2022.q,"Kellerei Girlan, Laurin Lagrein Merlot, 2022, 5000 ml",RED,,266.00
v.14321.2022.b,"Kellerei Girlan, Laurin Lagrein Merlot, 2022, 750 ml",RED,,38.00
v.8927.2017.c,"Kellerei Girlan, Pinot nero Riserva Trattmann, 2017, 1500 ml",RED,,170.00
v.8927.2020.b,"Kellerei Girlan, Pinot nero Riserva Trattmann, 2020, 750 ml",RED,,74.00
v.8927.2021.b,"Kellerei Girlan, Pinot nero Riserva Trattmann, 2021, 750 ml",RED,,69.00
v.8788.2023.b,"Kellerei Girlan, Pinot noir Patricia, 2023, 750 ml",RED,,36.00
v.59071.2019.b,"Kellerei Girlan, Pinot noir Riserva Curlan, 2019, 750 ml",RED,,115.00
v.59071.2020.b,"Kellerei Girlan, Pinot noir Riserva Curlan, 2020, 750 ml",RED,,114.00
v.60284.2021.b,"Kellerei Girlan, Pinot noir Riserva Flora, 2021, 750 ml",RED,,45.00
v.14237.2012.b,"Kellerei Girlan, Pinot noir Riserva Vigna Ganger, 2012, 750 ml",RED,,210.00
v.14237.2015.b,"Kellerei Girlan, Pinot noir Riserva Vigna Ganger, 2015, 750 ml",RED,,175.00
v.14237.2017.b,"Kellerei Girlan, Pinot noir Riserva Vigna Ganger, 2017, 750 ml",RED,,170.00
v.14237.2018.b,"Kellerei Girlan, Pinot noir Riserva Vigna Ganger, 2018, 750 ml",RED,,160.00
v.14237.2019.b,"Kellerei Girlan, Pinot noir Riserva Vigna Ganger, 2019, 750 ml",RED,,155.00
v.14237.2020.b,"Kellerei Girlan, Pinot noir Riserva Vigna Ganger, 2020, 750 ml",RED,,150.00
v.33600.2023.b,"Kellerei Girlan, Vernatsch Fass Nr. 9, 2023, 750 ml",RED,,35.00
v.14077.2022.b,"Kellerei Girlan, Vernatsch Gschleier Alte Reben, 2022, 750 ml",RED,,38.00
v.93682.2023.b,"Kellerei Kaltern, Goldmuskateller / Moscato giallo, 2023, 750 ml",WHITE,,34.00
v.47884.2023.b,"Kellerei Kaltern, Kalterersee Classico Superiore Quintessenz, 2023, 750 ml",RED,,35.00
v.52740.2021.b,"Kellerei Kaltern, Merlot Riserva Lasòn, 2021, 750 ml",RED,,38.00
v.49638.2021.b,"Kellerei Kaltern, Pinot bianco Quintessenz, 2021, 750 ml",WHITE,,45.00
v.93683.2023.b,"Kellerei Kaltern, Rosenmuskateller / Moscato rosa, 2023, 750 ml",,,34.00
v.1232.2021.b,"Kellerei Meran, Merlot Freiherr, 2021, 750 ml",RED,,46.00
v.54226.2020.b,"Kellerei Meran, Riserva 36 Brût, 2020, 750 ml",WHITE,18.00,46.00
v.99353.2020.b,"Kellerei Meran, Saperaia, 2020, 750 ml",RED,,72.00
v.8014.2022.b,"Kellerei Meran, Weissburgunder Tyrol, 2022, 750 ml",WHITE,13.00,38.00
v.32920.2019.b,"Kellerei St. Pauls, Pinot bianco Riserva Sanctissimus, 2019, 750 ml",WHITE,52.00,110.00
v.73983.0.b,"Kellerei St. Pauls, Praeclarus Blanc de Blancs Brût, 750 ml",WHITE,,49.00
v.64421.2023.b,"Kellerei St. Pauls, Weissburgunder Plötzner, 2023, 750 ml",WHITE,,34.00
v.6047.2021.b,"Kettmeir, Athesis Rosé Brût, 2021, 750 ml",,,48.00
v.48612.2024.b,"Klaus Lentsch, Goldmuskateller Amperg, 2024, 750 ml",WHITE,9.50,36.00
v.3745.2023.b,"Köfererhof, Sylvaner R, 2023, 750 ml",WHITE,17.00,46.00
v.52920.2017.c,"Kollerhof, Pinot nero Riserva Aegis, 2017, 1500 ml",RED,,130.00
v.52920.2017.b,"Kollerhof, Pinot nero Riserva Aegis, 2017, 750 ml",RED,,70.00
v.52920.2019.b,"Kollerhof, Pinot nero Riserva Aegis, 2019, 750 ml",RED,,77.00
v.52920.2020.b,"Kollerhof, Pinot nero Riserva Aegis, 2020, 750 ml",RED,,70.00
v.52920.2021.b,"Kollerhof, Pinot nero Riserva Aegis, 2021, 750 ml",RED,30.00,70.00
v.83059.0.b,"Krug, Grande Cuvée 172ème Édition Brût, 750 ml",WHITE,190.00,335.00
v.3779.2010.b,"La Spinetta, Barbaresco Riserva Vürsù Vigneto Valeirano, 2010, 750 ml",RED,,190.00
v.3787.2020.b,"La Spinetta, Barbera d'Asti Ca' di Pian, 2020, 750 ml",RED,,39.00
v.463.2021.c,"Le Macchiole, Bolgheri Rosso, 2021, 1500 ml",RED,,95.00
v.463.2021.b,"Le Macchiole, Bolgheri Rosso, 2021, 750 ml",RED,,47.00
v.465.2008.c,"Le Macchiole, Messorio, 2008, 1500 ml",RED,,500.00
v.465.2009.c,"Le Macchiole, Messorio, 2009, 1500 ml",RED,,500.00
v.465.2017.b,"Le Macchiole, Messorio, 2017, 750 ml",RED,,206.00
v.462.2020.b,"Le Macchiole, Paleo Rosso, 2020, 750 ml",RED,,142.00
v.464.2017.b,"Le Macchiole, Scrio, 2017, 750 ml",RED,,142.00
v.11293.2022.b,"Le Mortelle - Antinori, Poggio alle Nane, 2022, 750 ml",RED,39.00,83.00
v.58614.2022.b,"Leya, Terlano Classico Terlaner Riserva, 2022, 750 ml",WHITE,,43.00
v.46096.0.c,"Lieselehof, Lieselehof Brût, 1500 ml",WHITE,,151.00
v.46096.0.b,"Lieselehof, Lieselehof Brût, 750 ml",WHITE,,74.00
v.100719.2020.c,"Lieselehof, Rosé Brût, 2020, 1500 ml",,,128.00
v.100719.2020.b,"Lieselehof, Rosé Brût, 2020, 750 ml",,,58.00
v.4566.2015.a,"Lieselehof, Sweet Claire Passito, 2015, 375 ml",WHITE,,154.00
v.30666.2022.b,"Loacker, St. Magdalener Classico Morit, 2022, 750 ml",RED,,35.00
v.14736.2018.b,"Lodovico Antinori, Lodovico, 2018, 750 ml",RED,,510.00
v.98266.2019.b,"Lorenz Martini, Comitissa Pas dosé Riserva, 2019, 750 ml",WHITE,19.00,49.00
v.98136.2019.b,"Lucien Jacob, Savigny-Lès-Beaune, 2019, 750 ml",RED,26.00,59.00
v.39075.2019.b,"Luigi Pira, Barolo Margheria, 2019, 750 ml",RED,,76.00
v.42047.2019.b,"Lunelli - Tenuta Castelbuono, Montefalco Sagrantino Carapace, 2019, 750 ml",RED,,62.00
v.34559.2017.b,"Lunelli - Tenuta Podernovo, Auritea, 2017, 750 ml",RED,,78.00
v.14257.2022.b,"Manincor, Cassiano, 2022, 750 ml",RED,,64.00
v.18283.2020.b,"Manincor, Castel Campan, 2020, 750 ml",RED,,102.00
v.90500.2023.b,"Manincor, Il Conte, 2023, 750 ml",RED,,37.00
v.95791.2023.b,"Manincor, La Contessa, 2023, 750 ml",WHITE,,36.00
v.13288.2024.b,"Manincor, La Rose de Manincor, 2024, 750 ml",,,38.00
v.5032.2021.a,"Manincor, Le Petit, 2021, 375 ml",WHITE,34.00,78.00
v.225.1979.b,"Marchesi Antinori, Solaia, 1979, 750 ml",RED,,"1,000.00"
v.225.1982.b,"Marchesi Antinori, Solaia, 1982, 750 ml",RED,,800.00
v.225.1986.b,"Marchesi Antinori, Solaia, 1986, 750 ml",RED,,710.00
v.225.1990.b,"Marchesi Antinori, Solaia, 1990, 750 ml",RED,,620.00
v.225.1991.b,"Marchesi Antinori, Solaia, 1991, 750 ml",RED,,600.00
v.225.1993.b,"Marchesi Antinori, Solaia, 1993, 750 ml",RED,,585.00
v.225.1994.b,"Marchesi Antinori, Solaia, 1994, 750 ml",RED,,570.00
v.225.1995.b,"Marchesi Antinori, Solaia, 1995, 750 ml",RED,,540.00
v.225.1998.b,"Marchesi Antinori, Solaia, 1998, 750 ml",RED,,500.00
v.225.1999.b,"Marchesi Antinori, Solaia, 1999, 750 ml",RED,,490.00
v.225.2000.b,"Marchesi Antinori, Solaia, 2000, 750 ml",RED,,475.00
v.225.2001.b,"Marchesi Antinori, Solaia, 2001, 750 ml",RED,,470.00
v.225.2003.b,"Marchesi Antinori, Solaia, 2003, 750 ml",RED,,430.00
v.225.2004.b,"Marchesi Antinori, Solaia, 2004, 750 ml",RED,,460.00
v.225.2005.b,"Marchesi Antinori, Solaia, 2005, 750 ml",RED,,415.00
v.225.2006.b,"Marchesi Antinori, Solaia, 2006, 750 ml",RED,,340.00
v.225.2012.b,"Marchesi Antinori, Solaia, 2012, 750 ml",RED,,360.00
v.225.2013.c,"Marchesi Antinori, Solaia, 2013, 1500 ml",RED,,950.00
v.225.2013.b,"Marchesi Antinori, Solaia, 2013, 750 ml",RED,,350.00
v.225.2014.b,"Marchesi Antinori, Solaia, 2014, 750 ml",RED,,345.00
v.225.2021.b,"Marchesi Antinori, Solaia, 2021, 750 ml",RED,195.00,330.00
v.224.1990.b,"Marchesi Antinori, Tignanello, 1990, 750 ml",RED,,180.00
v.224.2019.b,"Marchesi Antinori, Tignanello, 2019, 750 ml",RED,,155.00
v.224.2020.b,"Marchesi Antinori, Tignanello, 2020, 750 ml",RED,,147.00
v.224.2021.b,"Marchesi Antinori, Tignanello, 2021, 750 ml",RED,,145.00
v.6334.1990.b,"Marchesi di Barolo, Barolo Riserva, 1990, 750 ml",RED,,320.00
v.6334.2003.b,"Marchesi di Barolo, Barolo Riserva, 2003, 750 ml",RED,,255.00
v.6334.2009.b,"Marchesi di Barolo, Barolo Riserva, 2009, 750 ml",RED,,180.00
v.30504.2021.b,"Martin Abraham, Pinot blanc Art Limited Edition, 2021, 750 ml",WHITE,,71.00
v.14456.2023.b,"Martin Abraham, Weissburgunder In der Lamm von Alten Reben, 2023, 750 ml",WHITE,,37.00
v.8480.2022.b,"Matteo Correggia, Barbera d'Alba Superiore Marùn, 2022, 750 ml",RED,,43.00
v.37420.2017.b,"Matteo Correggia, Roero Arneis La Val dei Preti, 2017, 750 ml",WHITE,,46.00
v.437.2004.b,"Mazzei - Castello di Fonterutoli, Siepi, 2004, 750 ml",RED,,160.00
v.437.2017.b,"Mazzei - Castello di Fonterutoli, Siepi, 2017, 750 ml",RED,,150.00
v.437.2019.b,"Mazzei - Castello di Fonterutoli, Siepi, 2019, 750 ml",RED,,145.00
v.32736.2020.b,"Messnerhof, Lagrein Riserva, 2020, 750 ml",RED,16.00,43.00
v.92621.2023.b,"Michael Puff, Pinot noir, 2023, 750 ml",RED,14.90,38.00
v.11508.0.b,"Moët & Chandon, Ice Impérial, 750 ml",WHITE,,135.00
v.11616.0.b,"Moët & Chandon, Réserve Impériale Brût, 750 ml",WHITE,,96.00
v.31228.0.b,"Montelvini, Prosecco Cuvée dell'Erede Extra dry, 750 ml",WHITE,,35.00
v.30951.2021.b,"Monteverro, Chardonnay, 2021, 750 ml",WHITE,62.00,119.00
v.18427.2012.b,"Monteverro, Monteverro, 2012, 750 ml",RED,,190.00
v.18427.2013.b,"Monteverro, Monteverro, 2013, 750 ml",RED,,183.00
v.18427.2014.b,"Monteverro, Monteverro, 2014, 750 ml",RED,,179.00
v.18427.2015.b,"Monteverro, Monteverro, 2015, 750 ml",RED,,175.00
v.18427.2016.b,"Monteverro, Monteverro, 2016, 750 ml",RED,,170.00
v.18427.2017.b,"Monteverro, Monteverro, 2017, 750 ml",RED,99.00,168.00
v.18427.2018.b,"Monteverro, Monteverro, 2018, 750 ml",RED,,164.00
v.18427.2019.b,"Monteverro, Monteverro, 2019, 750 ml",RED,,162.00
v.18427.2020.b,"Monteverro, Monteverro, 2020, 750 ml",RED,96.00,160.00
v.30952.2019.b,"Monteverro, Terra di Monteverro, 2019, 750 ml",RED,,76.00
v.52397.2012.b,"Monteverro, Tinata, 2012, 750 ml",RED,,145.00
v.52397.2013.b,"Monteverro, Tinata, 2013, 750 ml",RED,,137.00
v.52397.2014.b,"Monteverro, Tinata, 2014, 750 ml",RED,,133.00
v.52397.2015.b,"Monteverro, Tinata, 2015, 750 ml",RED,,130.00
v.52397.2016.b,"Monteverro, Tinata, 2016, 750 ml",RED,,126.00
v.52397.2018.b,"Monteverro, Tinata, 2018, 750 ml",RED,,120.00
v.52397.2019.b,"Monteverro, Tinata, 2019, 750 ml",RED,60.00,115.00
v.52397.2020.b,"Monteverro, Tinata, 2020, 750 ml",RED,65.00,115.00
v.402.2003.c,"Montevertine, Le Pergole Torte, 2003, 1500 ml",RED,,870.00
v.402.2019.b,"Montevertine, Le Pergole Torte, 2019, 750 ml",RED,,200.00
v.402.2020.b,"Montevertine, Le Pergole Torte, 2020, 750 ml",RED,,179.00
v.403.2018.b,"Montevertine, Montevertine, 2018, 750 ml",RED,,87.00
v.43046.2021.b,"Montonale, Lugana Montunal, 2021, 750 ml",WHITE,15.00,38.00
v.81443.2020.c,"Morandell, Cabernet franc Riserva Podalirius Vigna Peters Kreid, 2020, 1500 ml",RED,,95.00
v.81443.2021.b,"Morandell, Cabernet franc Riserva Podalirius Vigna Peters Kreid, 2021, 750 ml",RED,,46.00
v.83141.2024.b,"Morandell, Lago di Caldaro Classico Delia, 2024, 750 ml",RED,,35.00
v.100748.2023.c,"Morandell, Pinot grigio Alia, 2023, 1500 ml",WHITE,,72.00
v.100748.2024.b,"Morandell, Pinot grigio Alia, 2024, 750 ml",WHITE,,35.00
v.92812.2021.b,"Mount Langi Ghiran, Shiraz Cliff Edge, 2021, 750 ml",RED,,43.00
v.8498.2020.b,"Musella, Valpolicella Ripasso Superiore, 2020, 750 ml",RED,12.40,37.00
v.46395.2021.b,"Nals Margreid, Cabernet Riserva Lafot, 2021, 750 ml",RED,,39.00
v.4768.2023.b,"Nals Margreid, Gewürztraminer Lyra, 2023, 750 ml",WHITE,,38.00
v.5167.2021.b,"Nals Margreid, Merlot Levad, 2021, 750 ml",RED,,37.00
v.72357.2020.b,"Nals Margreid, Nama, 2020, 750 ml",WHITE,,127.00
v.4766.2022.b,"Nals Margreid, Pinot bianco Sirmian, 2022, 750 ml",WHITE,,45.00
v.4765.2022.b,"Nals Margreid, Pinot grigio Punggl, 2022, 750 ml",WHITE,,38.00
v.4770.2022.b,"Nals Margreid, Sauvignon Mantele, 2022, 750 ml",WHITE,,44.00
v.5300.2023.b,"Nals Margreid, Schiava Galea, 2023, 750 ml",RED,12.00,36.00
v.6348.2017.b,"Oasi degli Angeli, Kurni, 2017, 750 ml",RED,,143.00
v.6348.2018.b,"Oasi degli Angeli, Kurni, 2018, 750 ml",RED,,142.00
v.6348.2019.b,"Oasi degli Angeli, Kurni, 2019, 750 ml",RED,,142.00
v.897.2018.b,"Opus One (Mondavi - Rothschild), Napa Valley Opus One, 2018, 750 ml",RED,,680.00
v.312.2022.b,"Ornellaia, Bolgheri Le Serre Nuove, 2022, 750 ml",RED,40.00,85.00
v.313.1996.b,"Ornellaia, Bolgheri Superiore Ornellaia, 1996, 750 ml",RED,,460.00
v.313.1999.b,"Ornellaia, Bolgheri Superiore Ornellaia, 1999, 750 ml",RED,,430.00
v.313.2001.b,"Ornellaia, Bolgheri Superiore Ornellaia, 2001, 750 ml",RED,,415.00
v.313.2003.b,"Ornellaia, Bolgheri Superiore Ornellaia, 2003, 750 ml",RED,,395.00
v.313.2004.b,"Ornellaia, Bolgheri Superiore Ornellaia, 2004, 750 ml",RED,,390.00
v.313.2006.b,"Ornellaia, Bolgheri Superiore Ornellaia, 2006, 750 ml",RED,,370.00
v.313.2008.b,"Ornellaia, Bolgheri Superiore Ornellaia, 2008, 750 ml",RED,,365.00
v.313.2011.b,"Ornellaia, Bolgheri Superiore Ornellaia, 2011, 750 ml",RED,,350.00
v.313.2012.b,"Ornellaia, Bolgheri Superiore Ornellaia, 2012, 750 ml",RED,,340.00
v.313.2013.b,"Ornellaia, Bolgheri Superiore Ornellaia, 2013, 750 ml",RED,,345.00
v.313.2014.b,"Ornellaia, Bolgheri Superiore Ornellaia, 2014, 750 ml",RED,,315.00
v.313.2018.b,"Ornellaia, Bolgheri Superiore Ornellaia, 2018, 750 ml",RED,,260.00
v.313.2020.b,"Ornellaia, Bolgheri Superiore Ornellaia, 2020, 750 ml",RED,120.00,230.00
v.3668.2022.b,"Ornellaia, Le Volte dell’Ornellaia, 2022, 750 ml",RED,,43.00
v.8942.2024.b,"Pacher Hof, Kerner, 2024, 750 ml",WHITE,,35.00
v.8943.2023.b,"Pacher Hof, Riesling, 2023, 750 ml",WHITE,,35.00
v.14417.2021.b,"Pacher Hof, Sylvaner Riserva Alte Reben, 2021, 750 ml",WHITE,,47.00
v.17303.0.b,"Palmer, Brut Réserve, 750 ml",WHITE,35.00,88.00
v.66216.2018.b,"Parusso, Barolo Perarmando, 2018, 750 ml",RED,,76.00
v.78244.2000.c,"Parusso, Barolo Riserva Oro Bussia Per Francesco, 2000, 1500 ml",RED,,"1,200.00"
v.3499.2014.b,"Perrier-Joüet, Belle Époque Brût, 2014, 750 ml",WHITE,,280.00
v.14662.2023.b,"Peter Jakob Kühn, Riesling Trocken Jacobus, 2023, 750 ml",WHITE,,43.00
v.14668.2020.b,"Peter Jakob Kühn, Riesling Trocken Mittelheim St. Nikolaus, 2020, 750 ml",WHITE,,92.00
v.46396.2022.b,"Peter Sölva, Amistar Cuvée Bianco, 2022, 750 ml",WHITE,28.00,64.00
v.94865.2023.b,"Peter Zemmer, Chardonnay Buchholz, 2023, 750 ml",WHITE,,37.00
v.46388.2021.c,"Peter Zemmer, Lagrein Riserva Furggl, 2021, 1500 ml",RED,,90.00
v.46388.2022.b,"Peter Zemmer, Lagrein Riserva Furggl, 2022, 750 ml",RED,,45.00
v.36572.2021.c,"Peter Zemmer, Pinot grigio Riserva Giatl, 2021, 1500 ml",WHITE,,98.00
v.36572.2021.b,"Peter Zemmer, Pinot grigio Riserva Giatl, 2021, 750 ml",WHITE,,48.00
v.9097.2008.b,"Petra, Petra Rosso, 2008, 750 ml",RED,,94.00
v.48118.2023.b,"Pfannenstielhof, Lagrein Vom Boden, 2023, 750 ml",RED,,36.00
v.79411.2019.b,"Pfannenstielhof, St. Magdalener Classico Der Pfannenstiel, 2019, 750 ml",RED,40.00,88.00
v.47888.2023.b,"Pfannenstielhof, St. Magdalener Classico, 2023, 750 ml",RED,,35.00
v.4877.2022.b,"Pfitscher, Pinot nero Riserva Matan, 2022, 750 ml",RED,30.00,66.00
v.45059.2021.b,"Pfitscher, Sauvignon blanc Riserva Mathias, 2021, 750 ml",WHITE,,66.00
v.55558.2020.b,"Philippe Bouzereau, Bourgogne Côte d’Or Blanc, 2020, 750 ml",WHITE,,57.00
v.13097.2015.b,"Pian dell'Orino, Brunello di Montalcino Vigneti del Versante, 2015, 750 ml",RED,,125.00
v.13099.2015.b,"Pian dell'Orino, Rosso di Montalcino, 2015, 750 ml",RED,,95.00
v.13099.2017.b,"Pian dell'Orino, Rosso di Montalcino, 2017, 750 ml",RED,,90.00
v.13099.2019.b,"Pian dell'Orino, Rosso di Montalcino, 2019, 750 ml",RED,,88.00
v.15630.2016.b,"Planeta, Chardonnay Didacus, 2016, 750 ml",WHITE,,86.00
v.63037.2016.b,"Planeta, Menfi Didacus, 2016, 750 ml",RED,,84.00
v.9305.2021.b,"Podere Le Bèrne, Vino Nobile di Montepulciano Riserva, 2021, 750 ml",RED,20.80,52.00
v.40430.2019.b,"Poggio al Sole, Chianti Classico Gran Selezione Casasilia, 2019, 750 ml",RED,,67.00
v.68712.2022.b,"Poggio al Sole, Chianti Classico, 2022, 750 ml",RED,,35.00
v.100795.2019.b,"Poggio al Sole, Ponente, 2019, 750 ml",RED,,67.00
v.3152.2020.b,"Poggio al Tesoro, Bolgheri Dedicato a Walter, 2020, 750 ml",RED,100.00,200.00
v.16531.2022.b,"Poggio al Tesoro, Bolgheri Rosso Il Seggio, 2022, 750 ml",RED,15.30,45.00
v.3151.2020.c,"Poggio al Tesoro, Bolgheri Superiore Sondraia Rosso, 2020, 1500 ml",RED,110.00,200.00
v.3151.2020.b,"Poggio al Tesoro, Bolgheri Superiore Sondraia Rosso, 2020, 750 ml",RED,48.00,89.00
v.16121.2018.b,"Poggio al Tesoro, Bolgheri Vermentino Solosole Pagus Camilla, 2018, 750 ml",WHITE,25.00,58.00
v.16123.2016.m,"Poggio al Tesoro, Passito Teos, 2016, 500 ml",WHITE,48.00,95.00
v.55977.2022.b,"Poggio al Tesoro, Sondraia Bianco, 2022, 750 ml",WHITE,30.00,66.00
v.8492.0.d,"Pojer e Sandri, Rosé Brût, 3000 ml",,,320.00
v.16270.2022.b,"Prager, Grüner Veltliner Federspiel Hinter der Burg, 2022, 750 ml",WHITE,,64.00
v.12461.2019.b,"Prager, Riesling Smaragd Klaus, 2019, 750 ml",WHITE,,88.00
v.107117.2019.c,"Produttori San Michele Appiano, Appius Robert Pan, 2019, 1500 ml",WHITE,420.00,980.00
v.4774.2010.b,"Produttori San Michele Appiano, Appius, 2010, 750 ml",WHITE,,320.00
v.4774.2011.b,"Produttori San Michele Appiano, Appius, 2011, 750 ml",WHITE,,245.00
v.4774.2012.b,"Produttori San Michele Appiano, Appius, 2012, 750 ml",WHITE,,239.00
v.4774.2013.b,"Produttori San Michele Appiano, Appius, 2013, 750 ml",WHITE,,231.00
v.4774.2015.b,"Produttori San Michele Appiano, Appius, 2015, 750 ml",WHITE,,209.00
v.4774.2016.b,"Produttori San Michele Appiano, Appius, 2016, 750 ml",WHITE,,200.00
v.4774.2017.b,"Produttori San Michele Appiano, Appius, 2017, 750 ml",WHITE,,191.00
v.4774.2018.c,"Produttori San Michele Appiano, Appius, 2018, 1500 ml",WHITE,,360.00
v.4774.2018.b,"Produttori San Michele Appiano, Appius, 2018, 750 ml",WHITE,,177.00
v.4774.2019.c,"Produttori San Michele Appiano, Appius, 2019, 1500 ml",WHITE,,350.00
v.4774.2019.b,"Produttori San Michele Appiano, Appius, 2019, 750 ml",WHITE,,171.00
v.4774.2020.b,"Produttori San Michele Appiano, Appius, 2020, 750 ml",WHITE,,170.00
v.14382.2021.b,"Produttori San Michele Appiano, Cabernet-Merlot Riserva Sanct Valentin, 2021, 750 ml",RED,25.00,59.00
v.863.2007.b,"Produttori San Michele Appiano, Pinot bianco Sanct Valentin, 2007, 750 ml",WHITE,,92.00
v.863.2008.b,"Produttori San Michele Appiano, Pinot bianco Sanct Valentin, 2008, 750 ml",WHITE,,92.00
v.863.2009.b,"Produttori San Michele Appiano, Pinot bianco Sanct Valentin, 2009, 750 ml",WHITE,,92.00
v.863.2022.b,"Produttori San Michele Appiano, Pinot bianco Sanct Valentin, 2022, 750 ml",WHITE,,46.00
v.13936.2023.c,"Produttori San Michele Appiano, Pinot bianco Schulthauser, 2023, 1500 ml",WHITE,,70.00
v.13936.2024.b,"Produttori San Michele Appiano, Pinot bianco Schulthauser, 2024, 750 ml",WHITE,,34.00
v.865.2022.b,"Produttori San Michele Appiano, Pinot grigio Sanct Valentin, 2022, 750 ml",WHITE,19.40,47.00
v.870.2021.b,"Produttori San Michele Appiano, Pinot Noir Riserva Sanct Valentin, 2021, 750 ml",RED,,66.00
v.42656.2016.b,"Produttori San Michele Appiano, Pinot noir Riserva The Wine Collection, 2016, 750 ml",RED,,127.00
v.42656.2018.c,"Produttori San Michele Appiano, Pinot noir Riserva The Wine Collection, 2018, 1500 ml",RED,,255.00
v.42656.2018.b,"Produttori San Michele Appiano, Pinot noir Riserva The Wine Collection, 2018, 750 ml",RED,,120.00
v.81061.2024.b,"Produttori San Michele Appiano, Pinot noir Rosé Fallwind, 2024, 750 ml",,,37.00
v.85444.2021.b,"Produttori San Michele Appiano, Pinot noir Rosé The Wine Collection, 2021, 750 ml",,,88.00
v.868.2022.a,"Produttori San Michele Appiano, Sanct Valentin Comtess Passito, 2022, 375 ml",WHITE,,64.00
v.866.2009.b,"Produttori San Michele Appiano, Sauvignon Sanct Valentin, 2009, 750 ml",WHITE,,98.00
v.866.2011.b,"Produttori San Michele Appiano, Sauvignon Sanct Valentin, 2011, 750 ml",WHITE,,88.00
v.866.2023.b,"Produttori San Michele Appiano, Sauvignon Sanct Valentin, 2023, 750 ml",WHITE,,46.00
v.30772.2018.c,"Produttori San Michele Appiano, Sauvignon The Wine Collection, 2018, 1500 ml",WHITE,,250.00
v.30772.2018.b,"Produttori San Michele Appiano, Sauvignon The Wine Collection, 2018, 750 ml",WHITE,,119.00
v.10661.2019.b,"Prunotto, Barbaresco Bric Turot, 2019, 750 ml",RED,,66.00
v.5201.1998.d,"Prunotto, Barolo Bussia, 1998, 3000 ml",RED,,500.00
v.389.2008.b,"Querciabella, Camartina, 2008, 750 ml",RED,,130.00
v.7210.2024.b,"Quintodecimo, Falanghina Via del Campo, 2024, 750 ml",WHITE,,64.00
v.11784.2023.b,"Radoar, Kerner Radoy, 2023, 750 ml",WHITE,,37.00
v.34331.2023.b,"Radoar, Müller Thurgau Etza, 2023, 750 ml",WHITE,,35.00
v.62493.2021.b,"Radoar, Riesling Vives, 2021, 750 ml",WHITE,,45.00
v.14660.2023.b,"Reinhold Haart, Riesling Feinherb Haart to Heart, 2023, 750 ml",WHITE,,38.00
v.34891.2019.b,"Reinhold Haart, Riesling Trocken Piesporter Goldtröpfchen, 2019, 750 ml",WHITE,,70.00
v.18288.2019.b,"Réva, Barolo Ravera, 2019, 750 ml",RED,55.00,125.00
v.18287.2021.b,"Réva, Barolo, 2021, 750 ml",RED,24.00,65.00
v.100803.2016.b,"Ridge, Zinfandel East Bench, 2016, 750 ml",RED,,77.00
v.63495.2020.b,"Riecine, Riecine di Riecine, 2020, 750 ml",RED,55.00,105.00
v.65211.2021.b,"Ritterhof, Cabernet sauvignon Gratus, 2021, 750 ml",RED,14.00,40.00
v.3872.2023.b,"Ritterhof, Gewürztraminer Auratus Crescendo, 2023, 750 ml",WHITE,,46.00
v.81438.2009.c,"Ritterhof, Lagrein Riserva Manus, 2009, 1500 ml",RED,,195.00
v.81438.2019.b,"Ritterhof, Lagrein Riserva Manus, 2019, 750 ml",RED,,73.00
v.100752.2022.b,"Ritterhof, Pinot grigio Opes, 2022, 750 ml",WHITE,,39.00
v.760.2012.b,"Rocca di Frassinello, Baffonero, 2012, 750 ml",RED,,230.00
v.13498.2021.b,"Rocca di Montegrossi, Chianti Classico, 2021, 750 ml",RED,,37.50
v.13501.2018.b,"Rocca di Montegrossi, Geremia, 2018, 750 ml",RED,,70.00
v.5286.2008.b,"Rocche dei Manzoni, Barolo, 2008, 750 ml",RED,,173.00
v.5286.2009.b,"Rocche dei Manzoni, Barolo, 2009, 750 ml",RED,,168.00
v.5286.2010.b,"Rocche dei Manzoni, Barolo, 2010, 750 ml",RED,,178.00
v.10565.2020.b,"Rocche dei Manzoni, Langhe Rosso Quatr Nas, 2020, 750 ml",RED,24.00,65.00
v.57931.2021.b,"Röck, Pet Nat, 2021, 750 ml",WHITE,,38.00
v.54505.2022.b,"Rohregger, Sauvignon blanc Vom Kalk, 2022, 750 ml",WHITE,,44.00
v.5308.2010.b,"Romano Dal Forno, Amarone della Valpolicella Vigna di Monte Lodoletta, 2010, 750 ml",RED,,580.00
v.5308.2012.b,"Romano Dal Forno, Amarone della Valpolicella Vigna di Monte Lodoletta, 2012, 750 ml",RED,,550.00
v.36547.2021.a,"Rottensteiner, Gewürztraminer Passito Cresta, 2021, 375 ml",WHITE,,72.00
v.36593.2022.b,"Rottensteiner, Lagrein Riserva Select, 2022, 750 ml",RED,19.00,44.00
v.61130.2021.c,"Rottensteiner, Lagrein Riserva, 2021, 1500 ml",RED,,99.00
v.62676.2023.c,"Rottensteiner, Santa Maddalena Classico Vigna Premstallerhof, 2023, 1500 ml",RED,,87.00
v.62676.2023.b,"Rottensteiner, Santa Maddalena Classico Vigna Premstallerhof, 2023, 750 ml",RED,13.00,39.00
v.70767.2021.b,"Rudi Pichler, Grüner Veltliner Smaragd Kollmütz, 2021, 750 ml",WHITE,,76.00
