external_id,full_details,type,purchase_price_eur,sales_price_eur
v.69999.2020.c,"Abbazia di Novacella, Cor unum et anima una, 2020, 1500 ml",WHITE,,114.00
v.13842.2022.b,"Abbazia di Novacella, Grüner Veltliner Praepositus, 2022, 750 ml",WHITE,,35.00
v.13841.2023.b,"Abbazia di Novacella, Kerner Praepositus, 2023, 750 ml",WHITE,,35.00
v.6142.2022.b,"Abbazia di Novacella, Riesling Praepositus, 2022, 750 ml",WHITE,,37.00
v.100767.2019.b,"Acham-Magin, Riesling Ungeheuer, 2019, 750 ml",WHITE,,91.00
v.10282.2020.b,"Albino Rocca, Barbaresco Ronchi, 2020, 750 ml",RED,,74.00
v.35838.2020.b,"Albino Rocca, Barbera d'Alba Gepin, 2020, 750 ml",RED,,41.00
v.9081.2017.b,"Alejandro Fernandez Tinto Pesquera, Ribera del Duero Tinto Pesquera Crianza, 2017, 750 ml",RED,,53.00
v.79189.2022.b,"Alheit Vineyards, Chenin blanc Hereafter Here, 2022, 750 ml",WHITE,,65.00
v.612.2019.b,"Allegrini, Amarone della Valpolicella Classico, 2019, 750 ml",RED,,103.00
v.611.2021.b,"Allegrini, Palazzo della Torre, 2021, 750 ml",RED,,38.00
v.615.2023.b,"Allegrini, Valpolicella Classico, 2023, 750 ml",RED,,36.00
v.14020.2011.c,"Alois Lageder, Cabernet Löwengang, 2011, 1500 ml",RED,,190.00
v.6774.2023.b,"Alois Lageder, Chardonnay Gaun, 2023, 750 ml",WHITE,13.00,40.00
v.6775.2020.c,"Alois Lageder, Chardonnay Löwengang, 2020, 1500 ml",WHITE,,190.00
v.6775.2020.b,"Alois Lageder, Chardonnay Löwengang, 2020, 750 ml",WHITE,,88.00
v.6775.2021.c,"Alois Lageder, Chardonnay Löwengang, 2021, 1500 ml",WHITE,,190.00
v.8962.1995.b,"Alois Lageder, Cor Römigberg, 1995, 750 ml",RED,,176.00
v.8962.1996.b,"Alois Lageder, Cor Römigberg, 1996, 750 ml",RED,,150.00
v.8962.1998.b,"Alois Lageder, Cor Römigberg, 1998, 750 ml",RED,89.50,180.00
v.8962.2004.b,"Alois Lageder, Cor Römigberg, 2004, 750 ml",RED,75.50,150.00
v.8962.2006.c,"Alois Lageder, Cor Römigberg, 2006, 1500 ml",RED,,240.00
v.8962.2006.b,"Alois Lageder, Cor Römigberg, 2006, 750 ml",RED,,135.00
v.8962.2013.b,"Alois Lageder, Cor Römigberg, 2013, 750 ml",RED,56.00,110.00
v.8962.2015.b,"Alois Lageder, Cor Römigberg, 2015, 750 ml",RED,,91.00
v.8962.2016.b,"Alois Lageder, Cor Römigberg, 2016, 750 ml",RED,,85.00
v.8962.2017.b,"Alois Lageder, Cor Römigberg, 2017, 750 ml",RED,,82.00
v.96381.2020.b,"Alois Lageder, Löwengang Uvaggio Storico, 2020, 750 ml",RED,,103.00
v.18040.2003.b,"Alois Lageder, Merlot MCM, 2003, 750 ml",RED,,175.00
v.18040.2009.b,"Alois Lageder, Merlot MCM, 2009, 750 ml",RED,,130.00
v.18040.2015.b,"Alois Lageder, Merlot MCM, 2015, 750 ml",RED,,105.00
v.84382.2020.b,"Alois Lageder, Merlot MCMLVII Vecchie Viti, 2020, 750 ml",RED,,77.00
v.104481.2024.b,"Alois Lageder, Misto Mare, 2024, 750 ml",WHITE,7.00,35.00
v.17547.2023.b,"Alois Lageder, Pinot grigio, 2023, 750 ml",WHITE,12.00,34.00
v.9034.2011.c,"Alois Lageder, Pinot nero Krafuss, 2011, 1500 ml",RED,,175.00
v.100819.2011.b,"Andi Sölva, Viribus Unitis Landibell, 2011, 750 ml",RED,,100.00
v.59340.2009.b,"Andi Sölva, Viribus Unitis mit Vereinten Kräften Rot, 2009, 750 ml",RED,,110.00
v.59340.2017.b,"Andi Sölva, Viribus Unitis mit Vereinten Kräften Rot, 2017, 750 ml",RED,,94.00
v.59335.2016.b,"Andi Sölva, Viribus Unitis mit Vereinten Kräften Weiss, 2016, 750 ml",WHITE,,93.00
v.86116.2019.b,"André Brunel, Châteauneuf-du-Pape Les Cailloux, 2019, 750 ml",RED,30.00,77.00
v.37060.2023.b,"Andrian, Andrius, 2023, 750 ml",WHITE,,46.00
v.3874.2021.b,"Andrian, Lagrein Riserva Tor di Lupo, 2021, 750 ml",RED,,66.00
v.14203.2021.b,"Andrian, Merlot Riserva Gant, 2021, 750 ml",RED,,72.00
v.43782.2023.b,"Ansitz Waldgries, Santa Maddalena Classico Antheos, 2023, 750 ml",RED,12.00,36.00
v.241.2004.c,"Arnaldo Caprai, Sagrantino di Montefalco Collepiano, 2004, 1500 ml",RED,,225.00
v.1105.0.b,"Arunda, Talento Brût, 750 ml",WHITE,,45.00
v.13932.0.b,"Arunda, Talento Rosé Brût, 750 ml",,,61.00
v.92235.2021.b,"Augusta Bargilli, Chardonnay, 2021, 750 ml",WHITE,,48.00
v.37160.0.b,"Ballabio, Farfalla Noir Collection Extra brût, 750 ml",WHITE,,48.00
v.37159.0.b,"Ballabio, Farfalla Noir Collection Rosé Brût, 750 ml",,,62.00
v.4712.0.b,"Bellavista, Franciacorta Alma Gran Cuvée Brût, 750 ml",WHITE,,67.00
v.58617.2022.b,"Bergmannhof, Chardonnay Riserva Lina, 2022, 750 ml",WHITE,,45.00
v.1391.2023.b,"Bernhard Ott, Grüner Veltliner Fass 4, 2023, 750 ml",WHITE,,43.00
v.1390.2020.b,"Bernhard Ott, Grüner Veltliner Ried Rosenberg, 2020, 750 ml",WHITE,,85.00
v.5306.1994.b,"Bertani, Amarone della Valpolicella Classico, 1994, 750 ml",RED,,550.00
v.5306.2001.b,"Bertani, Amarone della Valpolicella Classico, 2001, 750 ml",RED,,290.00
v.5306.2004.b,"Bertani, Amarone della Valpolicella Classico, 2004, 750 ml",RED,,195.00
v.5306.2005.b,"Bertani, Amarone della Valpolicella Classico, 2005, 750 ml",RED,,221.00
v.5306.2010.b,"Bertani, Amarone della Valpolicella Classico, 2010, 750 ml",RED,,143.00
v.5306.2012.c,"Bertani, Amarone della Valpolicella Classico, 2012, 1500 ml",RED,,370.00
v.5306.2012.b,"Bertani, Amarone della Valpolicella Classico, 2012, 750 ml",RED,,143.00
v.12123.1967.b,"Bertani, Recioto Amarone della Valpolicella Classico Superiore, 1967, 750 ml",RED,,950.00
v.12123.1976.b,"Bertani, Recioto Amarone della Valpolicella Classico Superiore, 1976, 750 ml",RED,,"1,100.00"
v.69216.2022.b,"Besson, Chablis Montmains 1er Cru, 2022, 750 ml",WHITE,,65.00
v.5415.2019.b,"Bibi Graetz, Colore Rosso 20° Anniversario, 2019, 750 ml",RED,,474.00
v.384.2016.b,"Bibi Graetz, Testamatta Rosso, 2016, 750 ml",RED,,138.00
v.86957.2022.b,"Billard Père et Fils, Coteaux Bourguignons Chardonnay La Boule de Billard, 2022, 750 ml",WHITE,13.50,39.00
v.1585.0.b,"Billecart-Salmon, Brut Réserve, 750 ml",WHITE,,97.00
v.423.2018.b,"Biondi Santi, Brunello di Montalcino Il Greppo, 2018, 750 ml",RED,,205.00
v.10840.2019.b,"Bisson, Abissi Spumante, 2019, 750 ml",WHITE,,95.00
v.84858.0.b,"Bredasole, Franciacorta Quarantaquattro Racconti Brût (dég. 03/2024), 750 ml",WHITE,,42.00
v.33275.2021.b,"Bruno Rocca, Barbaresco Currà, 2021, 750 ml",RED,,116.00
v.34252.2013.b,"Bruno Rocca, Barbaresco Maria Adelaide, 2013, 750 ml",RED,,159.00
v.8451.2018.b,"Bruno Rocca, Barbaresco Rabajà, 2018, 750 ml",RED,,101.00
v.8451.2019.b,"Bruno Rocca, Barbaresco Rabajà, 2019, 750 ml",RED,,101.00
v.8451.2020.b,"Bruno Rocca, Barbaresco Rabajà, 2020, 750 ml",RED,,111.00
v.54757.2019.b,"Bruno Rocca, Barbaresco Riserva Rabajà, 2019, 750 ml",RED,,188.00
v.8452.2020.b,"Bruno Rocca, Barbaresco, 2020, 750 ml",RED,,70.00
v.8452.2021.b,"Bruno Rocca, Barbaresco, 2021, 750 ml",RED,,70.00
v.8235.2024.b,"Bruno Rocca, Dolcetto d'Alba Trifolè, 2024, 750 ml",RED,10.00,36.00
v.19839.0.b,"Burmester, Port Tawny 10 YO, 750 ml",RED,,39.00
v.8520.2018.b,"Ca' del Baio, Barbaresco Asili, 2018, 750 ml",RED,,78.00
v.8520.2019.b,"Ca' del Baio, Barbaresco Asili, 2019, 750 ml",RED,,78.00
v.934.1990.d,"Ca' del Bosco, Franciacorta Cuvée Annamaria Clementi Brut, 1990, 3000 ml",WHITE,,"1,500.00"
v.43055.0.b,"Ca' del Bosco, Franciacorta Cuvée Prestige Extra brût, 750 ml",WHITE,,73.00
v.12570.2021.b,"Ca' Lojera, Lugana Superiore, 2021, 750 ml",WHITE,13.00,38.00
v.339.2004.b,"Ca' Marcanda, Bolgheri Camarcanda, 2004, 750 ml",RED,,198.00
v.39017.2020.b,"Caiarossa, Aria di Caiarossa, 2020, 750 ml",RED,16.00,43.00
v.30121.2019.b,"Caiarossa, Caiarossa, 2019, 750 ml",RED,37.00,90.00
v.6883.2020.b,"Cantina di Colterenzio, LR Riserva, 2020, 750 ml",WHITE,69.50,154.00
v.37868.2022.b,"Cantina di Colterenzio, Pinot bianco Berg, 2022, 750 ml",WHITE,,37.00
v.58057.2020.b,"Cantina di Colterenzio, Pinot nero Riserva Lafòa, 2020, 750 ml",RED,25.00,61.00
v.12046.2022.b,"Cantina di Colterenzio, Pinot nero Riserva St. Daniel, 2022, 750 ml",RED,13.00,37.00
v.981.2023.b,"Cantina di Colterenzio, Sauvignon blanc Lafòa, 2023, 750 ml",WHITE,,48.00
v.100466.2021.b,"Cantina di Colterenzio, Sauvignon Riserva Gran Lafòa, 2021, 750 ml",WHITE,69.90,154.00
v.837.2023.b,"Cantina di Terlano, Chardonnay, 2023, 750 ml",WHITE,,35.00
v.827.2021.c,"Cantina di Terlano, Lagrein Riserva Porphyr, 2021, 1500 ml",RED,,188.00
v.827.2021.b,"Cantina di Terlano, Lagrein Riserva Porphyr, 2021, 750 ml",RED,,86.00
v.825.2009.c,"Cantina di Terlano, Nova Domus Riserva, 2009, 1500 ml",WHITE,,175.00
v.831.2022.b,"Cantina di Terlano, Pinot bianco Riserva Vorberg, 2022, 750 ml",WHITE,20.00,49.00
v.824.2022.c,"Cantina di Terlano, Sauvignon Quarz, 2022, 1500 ml",WHITE,,185.00
v.824.2022.b,"Cantina di Terlano, Sauvignon Quarz, 2022, 750 ml",WHITE,,85.00
v.828.2023.b,"Cantina di Terlano, Terlaner, 2023, 750 ml",WHITE,,35.00
v.4772.2020.b,"Cantina Kurtatsch, Gewürztraminer Riserva Brenntal, 2020, 750 ml",WHITE,,45.00
v.11937.2022.b,"Cantina Kurtatsch, Lagrein Riserva Frauenhügel, 2022, 750 ml",RED,,42.00
v.51892.2022.b,"Cantina Kurtatsch, Merlot cabernet Soma, 2022, 750 ml",RED,17.00,44.00
v.87148.2024.b,"Cantina Muri-Gries, Lagrein Kretzer, 2024, 750 ml",,,35.00
v.5299.2022.b,"Cantina Muri-Gries, Lagrein Riserva Abtei Muri, 2022, 750 ml",RED,20.00,49.00
v.32160.2020.b,"Cantina Muri-Gries, Lagrein Weingarten Klosteranger, 2020, 750 ml",RED,,111.00
v.9183.2017.c,"Cantina Produttori Bolzano, Cabernet Riserva Mumelter, 2017, 1500 ml",RED,,155.00
v.9183.2021.b,"Cantina Produttori Bolzano, Cabernet Riserva Mumelter, 2021, 750 ml",RED,,68.00
v.73227.2022.b,"Cantina Produttori Bolzano, Chardonnay Riserva Stegher, 2022, 750 ml",WHITE,,46.00
v.14278.2021.c,"Cantina Produttori Bolzano, Lagrein Riserva Gries Prestige line, 2021, 1500 ml",RED,,110.00
v.14278.2021.b,"Cantina Produttori Bolzano, Lagrein Riserva Gries Prestige line, 2021, 750 ml",RED,,49.00
v.5434.2021.f,"Cantina Produttori Bolzano, Lagrein Riserva Taber, 2021, 6000 ml",RED,,590.00
v.5434.2021.b,"Cantina Produttori Bolzano, Lagrein Riserva Taber, 2021, 750 ml",RED,35.00,80.00
v.59271.2020.b,"Cantina Produttori Bolzano, Lagrein-Merlot Mauritius, 2020, 750 ml",RED,,59.00
v.37324.2023.b,"Cantina Produttori Bolzano, St. Magdalener Huck am Bach, 2023, 750 ml",RED,,35.00
v.86855.2020.b,"Cantina Produttori Bolzano, TAL 1908, 2020, 750 ml",RED,,144.00
v.86855.2021.u,"Cantina Produttori Bolzano, TAL 1908, 2021, 1500 ml",RED,110.00,280.00
v.86855.2021.b,"Cantina Produttori Bolzano, TAL 1908, 2021, 750 ml",RED,68.00,134.00
v.86857.2020.b,"Cantina Produttori Bolzano, TAL 1930, 2020, 750 ml",WHITE,,114.00
v.86857.2021.c,"Cantina Produttori Bolzano, TAL 1930, 2021, 1500 ml",WHITE,100.00,220.00
v.86857.2021.b,"Cantina Produttori Bolzano, TAL 1930, 2021, 750 ml",WHITE,50.00,104.00
v.72704.2022.b,"Cantina Tramin, Alto Adige Merlot-Cabernet Rungg, 2022, 750 ml",RED,,36.00
v.33724.2018.c,"Cantina Tramin, Chardonnay Riserva Troy, 2018, 1500 ml",WHITE,,232.00
v.33724.2019.c,"Cantina Tramin, Chardonnay Riserva Troy, 2019, 1500 ml",WHITE,100.00,225.00
v.33724.2020.u,"Cantina Tramin, Chardonnay Riserva Troy, 2020, 1500 ml",WHITE,,215.00
v.33724.2021.b,"Cantina Tramin, Chardonnay Riserva Troy, 2021, 750 ml",WHITE,55.00,103.00
v.3732.2014.b,"Cantina Tramin, Gewürztraminer Nussbaumer, 2014, 750 ml",WHITE,,84.00
v.3732.2022.c,"Cantina Tramin, Gewürztraminer Nussbaumer, 2022, 1500 ml",WHITE,,100.00
v.3732.2023.b,"Cantina Tramin, Gewürztraminer Nussbaumer, 2023, 750 ml",WHITE,,49.00
v.14579.2010.b,"Cantina Tramin, Gewürztraminer Spätlese Epokale, 2010, 750 ml",WHITE,,440.00
v.14579.2011.b,"Cantina Tramin, Gewürztraminer Spätlese Epokale, 2011, 750 ml",WHITE,,390.00
v.14579.2012.b,"Cantina Tramin, Gewürztraminer Spätlese Epokale, 2012, 750 ml",WHITE,,340.00
v.14579.2015.b,"Cantina Tramin, Gewürztraminer Spätlese Epokale, 2015, 750 ml",WHITE,,330.00
v.14579.2016.b,"Cantina Tramin, Gewürztraminer Spätlese Epokale, 2016, 750 ml",WHITE,,320.00
v.11349.2016.a,"Cantina Tramin, Gewürztraminer Terminum Vendemmia Tardiva, 2016, 375 ml",WHITE,,102.00
v.11349.2017.a,"Cantina Tramin, Gewürztraminer Terminum Vendemmia Tardiva, 2017, 375 ml",WHITE,,99.00
v.11349.2022.a,"Cantina Tramin, Gewürztraminer Terminum Vendemmia Tardiva, 2022, 375 ml",WHITE,33.00,72.00
v.14229.2020.c,"Cantina Tramin, Lagrein Riserva Urban, 2020, 1500 ml",RED,,130.00
v.14229.2022.b,"Cantina Tramin, Lagrein Riserva Urban, 2022, 750 ml",RED,,63.00
v.35248.2019.c,"Cantina Tramin, Loam Riserva, 2019, 1500 ml",RED,,155.00
v.35248.2021.b,"Cantina Tramin, Loam Riserva, 2021, 750 ml",RED,,73.00
v.1135.2023.b,"Cantina Tramin, Pinot bianco Moriz, 2023, 750 ml",WHITE,10.00,34.00
v.13380.2022.b,"Cantina Tramin, Pinot grigio Unterebner, 2022, 750 ml",WHITE,,46.00
v.6021.2023.a,"Cantina Tramin, Roen Vendemmia Tardiva, 2023, 375 ml",WHITE,,52.00
v.14035.2023.b,"Cantina Tramin, Sauvignon Pepi, 2023, 750 ml",WHITE,,35.00
v.1136.2023.c,"Cantina Tramin, Stoan, 2023, 1500 ml",WHITE,42.00,102.00
v.1136.2023.b,"Cantina Tramin, Stoan, 2023, 750 ml",WHITE,19.80,47.00
v.87855.2020.b,"Cantina Valle Isarco, Cuvée Adamantis, 2020, 750 ml",WHITE,,119.00
v.99369.2020.b,"Cantina Valle Isarco, Granit 960, 2020, 750 ml",WHITE,100.00,180.00
v.35569.2023.b,"Cantina Valle Isarco, Kerner Aristos, 2023, 750 ml",WHITE,,41.00
v.100792.2020.b,"Cascina Ferro, Barbera d'Asti Superiore Vanet, 2020, 750 ml",RED,,37.00
v.31165.2022.b,"Case Alte, Nero d'Avola 16 Filari, 2022, 750 ml",RED,,35.00
v.315.1993.b,"Case Basse Soldera, Brunello di Montalcino, 1993, 750 ml",RED,,"1,300.00"
v.6838.2021.b,"Castelfeder, Chardonnay Riserva Burgum Novum, 2021, 750 ml",WHITE,,49.00
v.69031.2020.b,"Castelfeder, Chardonnay Riserva Kreuzweg Family Reserve, 2020, 750 ml",WHITE,,102.00
v.11462.2015.b,"Castelfeder, Gewürztraminer Vom Lehm, 2015, 750 ml",WHITE,,46.00
v.31324.2023.b,"Castelfeder, Pinot grigio 15, 2023, 750 ml",WHITE,14.00,35.00
v.30765.2022.b,"Castelfeder, Pinot nero Glen, 2022, 750 ml",RED,14.00,41.00
v.6840.2020.b,"Castelfeder, Pinot nero Riserva Burgum Novum, 2020, 750 ml",RED,21.00,54.00
v.487.2019.b,"Castellare di Castellina, I Sodi di San Niccolò, 2019, 750 ml",RED,,117.00
v.457.1994.b,"Castello dei Rampolla, Sammarco, 1994, 750 ml",RED,,120.00
v.457.1995.b,"Castello dei Rampolla, Sammarco, 1995, 750 ml",RED,,120.00
v.457.1996.b,"Castello dei Rampolla, Sammarco, 1996, 750 ml",RED,,130.00
v.457.2017.b,"Castello dei Rampolla, Sammarco, 2017, 750 ml",RED,,91.00
v.33885.2018.b,"Castello di Banfi a Montalcino, Brunello di Montalcino, 2018, 750 ml",RED,,57.00
v.10533.2023.b,"Château d’Esclans, Côtes de Provence Whispering Angel Rosé, 2023, 750 ml",,,48.00
v.1777.1986.b,"Château d'Yquem, Sauternes Château d'Yquem 1er Cru Sup., 1986, 750 ml",WHITE,,750.00
v.1777.1987.b,"Château d'Yquem, Sauternes Château d'Yquem 1er Cru Sup., 1987, 750 ml",WHITE,,750.00
v.100801.2016.b,"Château Grand Corbin-Despagne, Castillon Côtes de Bordeaux Château Ampélia, 2016, 750 ml",RED,,45.00
v.4340.1995.b,"Château Guiraud, Sauternes Château Guiraud 1er G.Cru Classé, 1995, 750 ml",WHITE,,146.50
v.4612.2016.b,"Château La Pointe, Château La Pointe, 2016, 750 ml",RED,,107.00
v.100262.2016.b,"Château Mauvesin Barton, Château Mauvesin Barton, 2016, 750 ml",RED,,63.00
v.1741.1990.b,"Château Mouton Rothschild, Château Mouton-Rothschild 1er G.Cru Classé, 1990, 750 ml",RED,,"1,050.00"
v.10092.2018.b,"Château Phélan Ségur, Château Phélan Ségur, 2018, 750 ml",RED,,86.00
v.6430.2010.b,"Château Pontet Canet, Château Pontet Canet Grand Cru Classé, 2010, 750 ml",RED,300.00,650.00
v.1122.2021.b,"Claudio Mariotto, Timorasso Derthona, 2021, 750 ml",WHITE,,34.00
v.44002.2009.b,"Clemens Waldthaler, Merlot Raut, 2009, 750 ml",RED,,92.00
v.64488.2018.b,"Clos du Clocher, Pomerol Clos du Clocher, 2018, 750 ml",RED,,93.00
v.6611.2024.b,"Cloudy Bay, Sauvignon, 2024, 750 ml",WHITE,,68.00
v.3161.2010.b,"Colle Santa Mustiola, Poggio ai Chiari, 2010, 750 ml",RED,,68.00
v.6270.2019.b,"Conterno Fantino, Langhe Rosso Monprà, 2019, 750 ml",RED,,63.00
v.101374.2019.b,"Corte Pavone, Brunello di Montalcino Fior di Meliloto, 2019, 750 ml",RED,42.00,95.00
v.48166.2019.b,"Corte Pavone, Brunello di Montalcino, 2019, 750 ml",RED,33.00,71.00
v.34124.2016.b,"Corte Pavone, Le Perle di Pavone Extra brût, 2016, 750 ml",,,43.00
v.48563.2022.b,"Corte Pavone, Rosso di Montalcino, 2022, 750 ml",RED,,35.00
v.102029.2020.b,"Dagernova, Mission Steillage Steile Madeleine trocken, 2020, 750 ml",RED,33.00,78.00
v.1341.2016.b,"Damijan Podversič, Kaplja, 2016, 750 ml",WHITE,,70.00
v.96231.2021.b,"Daniel Sigmund, Riesling, 2021, 750 ml",WHITE,17.00,44.00
v.81849.2023.b,"Daniel Sigmund, Silvaner, 2023, 750 ml",WHITE,17.00,40.00
v.3063.2017.b,"Di Filippo, Sagrantino di Montefalco, 2017, 750 ml",RED,,49.00
v.4746.2006.b,"Dom Pérignon, P2 Deuxième Plénitude Brût, 2006, 750 ml",WHITE,335.00,520.00
v.1642.2006.b,"Dom Pérignon, Vintage Brût, 2006, 750 ml",WHITE,,460.00
v.1642.2015.b,"Dom Pérignon, Vintage Brût, 2015, 750 ml",WHITE,170.00,310.00
v.56209.2016.b,"Domaine Leflaive, Puligny-Montrachet Les Combettes 1er Cru, 2016, 750 ml",WHITE,,520.00
v.4193.2013.b,"Domaine Leflaive, Puligny-Montrachet Les Folatières 1er Cru, 2013, 750 ml",WHITE,,510.00
v.5499.2016.b,"Domaine Leflaive, Puligny-Montrachet Les Pucelles 1er Cru, 2016, 750 ml",WHITE,,530.00
v.8271.2006.b,"Domenico Clerico, Barolo Aeroplanservaj, 2006, 750 ml",RED,,220.00
v.3762.2003.b,"Domenico Clerico, Barolo Percristina, 2003, 750 ml",RED,,128.00
v.8951.2023.b,"Donnafugata, Anthìlia, 2023, 750 ml",WHITE,,34.00
v.100910.0.b,"Dr. Fischer - J. Hofstätter, Riesling Sparkling Steinbock Zero, 750 ml",WHITE,,36.00
v.60224.2023.b,"Ebner, Valle Isarco Grüner Veltliner, 2023, 750 ml",WHITE,,34.00
v.14365.2014.b,"Elena Walch, Beyond the Clouds Argentum Bonum, 2014, 750 ml",WHITE,,154.00
v.14365.2015.b,"Elena Walch, Beyond the Clouds Argentum Bonum, 2015, 750 ml",WHITE,,148.00
v.14365.2016.b,"Elena Walch, Beyond the Clouds Argentum Bonum, 2016, 750 ml",WHITE,,145.00
v.11553.2022.b,"Elena Walch, Beyond the Clouds, 2022, 750 ml",WHITE,,92.00
v.979.2017.c,"Elena Walch, Cabernet Istrice, 2017, 1500 ml",RED,,122.00
v.979.2023.b,"Elena Walch, Cabernet Istrice, 2023, 750 ml",RED,,46.00
v.13868.2019.b,"Elena Walch, Cabernet sauvignon Riserva Vigna Castel Ringberg, 2019, 750 ml",RED,,76.00
v.978.2023.b,"Elena Walch, Chardonnay Cardellino, 2023, 750 ml",WHITE,,37.00
v.14366.2015.b,"Elena Walch, Gewürztraminer Kastelaz Argentum Bonum, 2015, 750 ml",WHITE,,107.00
v.13840.2022.a,"Elena Walch, Gewürztraminer Passito Cashmere, 2022, 375 ml",WHITE,,70.00
v.4904.2022.b,"Elena Walch, Gewürztraminer Vigna Kastelaz, 2022, 750 ml",WHITE,,66.00
v.35584.2024.b,"Elena Walch, Gewürztraminer, 2024, 750 ml",WHITE,13.00,37.00
v.34289.2021.b,"Elena Walch, Grande Cuvée Kermesse, 2021, 750 ml",RED,,79.00
v.65822.2023.b,"Elena Walch, Kaltersee Classico Superiore Per Sé, 2023, 750 ml",RED,11.00,34.00
v.46057.2019.b,"Elena Walch, Merlot Riserva Vigna Kastelaz, 2019, 750 ml",RED,,67.00
v.39155.2024.b,"Elena Walch, Merlot, 2024, 750 ml",RED,,37.00
v.977.2020.c,"Elena Walch, Pinot nero Ludwig, 2020, 1500 ml",RED,,152.00
v.977.2021.b,"Elena Walch, Pinot nero Ludwig, 2021, 750 ml",RED,,69.00
v.58752.2017.b,"Elena Walch, Pinot noir Riserva Aton, 2017, 750 ml",RED,,185.00
v.58752.2018.b,"Elena Walch, Pinot noir Riserva Aton, 2018, 750 ml",RED,,170.00
v.58752.2019.b,"Elena Walch, Pinot noir Riserva Aton, 2019, 750 ml",RED,,150.00
v.18245.2024.b,"Elena Walch, Rosé 20/26, 2024, 750 ml",,,36.00
v.100761.2021.b,"Emmerich Knoll, Riesling Federspiel Loibner, 2021, 750 ml",WHITE,,49.00
v.16291.2018.b,"Emmerich Knoll, Riesling Smaragd Ried Schütt Dürnsteiner, 2018, 750 ml",WHITE,,110.00
v.12927.2019.b,"Etyssa, Trentodoc Cuvée n. 8 Extra brût (dég. 04/2023), 2019, 750 ml",WHITE,,48.00
v.58903.2018.b,"Eudes, Etna Bianco Bianco di Monte, 2018, 750 ml",WHITE,,63.00
v.90103.2018.b,"Eudes, Etna Rosso Milleottocentoquaranta, 2018, 750 ml",RED,,83.00
v.87771.0.b,"Eymann, Riesling Cuvée N. 220 Extra brût, 750 ml",WHITE,,45.00
v.51544.1999.b,"F.X. Pichler, Riesling Smaragd Dürnsteiner Kellerberg, 1999, 750 ml",WHITE,,210.00
v.64480.1999.b,"F.X. Pichler, Riesling Smaragd Loibenberg, 1999, 750 ml",WHITE,,160.00
v.90455.1999.b,"F.X. Pichler, Riesling Smaragd Loibner Steinertal, 1999, 750 ml",WHITE,,155.00
v.986.2023.b,"Falkenstein, Riesling, 2023, 750 ml",WHITE,,43.00
v.767.1999.b,"Fattoria Le Pupille, Saffredi, 1999, 750 ml",RED,,138.00
v.767.2000.b,"Fattoria Le Pupille, Saffredi, 2000, 750 ml",RED,,140.00
v.767.2019.b,"Fattoria Le Pupille, Saffredi, 2019, 750 ml",RED,,123.00
v.66985.2021.b,"Fenja Hinz, Pinot blanc Riserva, 2021, 750 ml",WHITE,,80.00
v.6744.2021.b,"Ferghettina, Franciacorta Milledì Brût, 2021, 750 ml",WHITE,,48.00
v.6745.2021.b,"Ferghettina, Franciacorta Rosé Brût, 2021, 750 ml",,,48.00
v.67077.0.d,"Ferrari, Trentodoc F1 Podium Limited Edition Brût, 3000 ml",WHITE,,291.00
v.36765.2006.b,"Ferrari, Trentodoc Giulio Ferrari Riserva del Fondatore Edizione Limitata Extra brût (dég. anno/2024), 2006, 750 ml",WHITE,160.00,290.00
v.947.2004.b,"Ferrari, Trentodoc Giulio Ferrari Riserva del Fondatore Extra brut, 2004, 750 ml",WHITE,,352.00
v.79494.2012.b,"Ferrari, Trentodoc Giulio Ferrari Riserva del Fondatore Extra brut, 2012, 750 ml",WHITE,,225.00
v.33076.2009.b,"Ferrari, Trentodoc Giulio Ferrari Riserva del Fondatore Rosé Extra brût (dég. anno/2021), 2009, 750 ml",,,310.00
v.33076.2012.b,"Ferrari, Trentodoc Giulio Ferrari Riserva del Fondatore Rosé Extra brût (dég. anno/2023), 2012, 750 ml",,,290.00
v.4345.0.b,"Ferrari, Trentodoc Maximum Blanc de Blancs Brût, 750 ml",WHITE,,48.00
v.65019.2018.b,"Ferrari, Trentodoc Perlé Millesimato Brût (dég. anno/2025), 2018, 750 ml",WHITE,,69.00
v.67185.2017.c,"Ferrari, Trentodoc Perlé Millesimato Sboccatura Recente Brût, 2017, 1500 ml",WHITE,,140.00
v.98517.2006.b,"Ferrari, Trentodoc Riserva Bruno Lunelli Extra brût, 2006, 750 ml",WHITE,,"1,300.00"
v.952.2015.c,"Ferrari, Trentodoc Riserva Lunelli Extra brût (dég. anno/2022), 2015, 1500 ml",WHITE,,190.00
v.10483.2013.c,"Ferrari, Trentodoc Riserva Perlé Bianco Brût, 2013, 1500 ml",WHITE,,160.00
v.10483.2016.b,"Ferrari, Trentodoc Riserva Perlé Bianco Brût, 2016, 750 ml",WHITE,36.00,79.00
v.953.2017.b,"Ferrari, Trentodoc Riserva Perlé Nero Extra brût, 2017, 750 ml",WHITE,56.80,103.00
v.5075.2017.b,"Ferrari, Trentodoc Riserva Perlé Rosé Brût, 2017, 750 ml",,,81.00
v.63370.2023.b,"Fondo Indizeno, Chardonnay Monopolio Sannicola, 2023, 750 ml",WHITE,9.30,36.00
v.6361.2021.b,"Franchetti - Tenuta di Trinoro, Le Cupole di Trinoro, 2021, 750 ml",RED,,48.00
v.382.2017.b,"Franchetti - Tenuta di Trinoro, Tenuta di Trinoro, 2017, 750 ml",RED,,288.00
v.76398.2018.b,"Franco Conterno, Barolo Panerole, 2018, 750 ml",RED,,62.00
v.4557.2019.c,"Franz Gojer, Lagrein Riserva, 2019, 1500 ml",RED,,109.00
v.4557.2022.b,"Franz Gojer, Lagrein Riserva, 2022, 750 ml",RED,,45.00
v.94443.0.m,"Franz Gojer, Pipa XXII, 500 ml",RED,,68.00
v.14208.2023.b,"Franz Gojer, St. Magdalener Rondell, 2023, 750 ml",RED,13.00,38.00
v.66200.0.b,"Franz Gojer, Syrah, 750 ml",RED,,56.00
v.853.2022.b,"Franz Haas, Manna, 2022, 750 ml",WHITE,,61.00
v.858.2022.b,"Franz Haas, Pinot nero, 2022, 750 ml",RED,,61.00
v.334.2021.b,"Frescobaldi - Castello di Nipozzano, Chianti Rùfina Riserva Montesodi, 2021, 750 ml",RED,,64.00
v.919.2021.b,"Frescobaldi - Castello di Nipozzano, Chianti Rùfina Riserva Nipozzano Vecchie Viti, 2021, 750 ml",RED,,43.00
v.3801.2016.b,"Frescobaldi - Tenuta di Castiglioni, Giramonte, 2016, 750 ml",RED,,140.00
v.3801.2020.b,"Frescobaldi - Tenuta di Castiglioni, Giramonte, 2020, 750 ml",RED,,120.00
v.331.2003.b,"Frescobaldi - Tenuta Luce, Brunello di Montalcino Luce, 2003, 750 ml",RED,,245.00
v.331.2018.b,"Frescobaldi - Tenuta Luce, Brunello di Montalcino Luce, 2018, 750 ml",RED,,122.00
v.330.2017.b,"Frescobaldi - Tenuta Luce, Luce 25° Anniversary, 2017, 750 ml",RED,,168.00
v.330.2004.b,"Frescobaldi - Tenuta Luce, Luce, 2004, 750 ml",RED,,420.00
v.330.2008.b,"Frescobaldi - Tenuta Luce, Luce, 2008, 750 ml",RED,,300.00
v.330.2018.b,"Frescobaldi - Tenuta Luce, Luce, 2018, 750 ml",RED,,140.00
v.330.2019.b,"Frescobaldi - Tenuta Luce, Luce, 2019, 750 ml",RED,,138.00
v.330.2020.b,"Frescobaldi - Tenuta Luce, Luce, 2020, 750 ml",RED,,140.00
v.332.2021.b,"Frescobaldi - Tenuta Luce, Lucente, 2021, 750 ml",RED,,64.00
v.34036.2016.b,"Frescobaldi - Tenuta Luce, Lux Vitis, 2016, 750 ml",RED,,165.00
v.34036.2017.b,"Frescobaldi - Tenuta Luce, Lux Vitis, 2017, 750 ml",RED,,155.00
v.34036.2020.b,"Frescobaldi - Tenuta Luce, Lux Vitis, 2020, 750 ml",RED,,152.00
v.100763.2021.b,"Fürstlich Castell'sches, Silvaner Casteller Hohnart Monopol, 2021, 750 ml",WHITE,,45.00
v.5779.2012.c,"G.D. Vajra, Barolo Bricco delle Viole, 2012, 1500 ml",RED,,320.00
v.3764.2004.b,"Gaja, Barbaresco, 2004, 750 ml",RED,,320.00
v.1218.2021.b,"Gaja, Langhe Sito Moresco, 2021, 750 ml",RED,,66.00
v.43447.1994.b,"Gaja, Sitorey, 1994, 750 ml",RED,,160.00
v.6297.2016.b,"Galardi, Terra di Lavoro, 2016, 750 ml",RED,,75.00
v.6297.2017.b,"Galardi, Terra di Lavoro, 2017, 750 ml",RED,,75.00
v.100798.2020.b,"Génot-Boulanger, Pommard Vieilles Vignes, 2020, 750 ml",RED,,109.00
v.5962.2008.c,"Giacomo Borgogno, Barolo, 2008, 1500 ml",RED,90.00,230.00
v.5962.2020.c,"Giacomo Borgogno, Barolo, 2020, 1500 ml",RED,,165.00
v.5962.2020.b,"Giacomo Borgogno, Barolo, 2020, 750 ml",RED,35.00,75.00
v.86988.2022.b,"Giacomo Borgogno, Langhe Bartomè, 2022, 750 ml",RED,,44.00
v.8773.2021.c,"Giacomo Borgogno, Langhe Nebbiolo No Name, 2021, 1500 ml",RED,,105.00
v.8773.2021.b,"Giacomo Borgogno, Langhe Nebbiolo No Name, 2021, 750 ml",RED,,49.00
v.3772.1998.c,"Giacomo Conterno, Barolo Riserva Monfortino, 1998, 1500 ml",RED,,"4,700.00"
v.56297.2022.b,"Gianni Doglia, Moscato d'Asti Casa di Bianca, 2022, 750 ml",WHITE,,34.00
v.7936.2018.b,"Giovanni Corino, Barolo Giachini, 2018, 750 ml",RED,33.00,75.00
v.30950.2019.b,"Giovanni Rosso, Barolo Serralunga, 2019, 750 ml",RED,,67.00
v.8899.2017.b,"Giovanni Rosso, Barolo Vigna Rionda Ester Canale, 2017, 750 ml",RED,,340.00
v.18294.2022.c,"Giovanni Rosso, Langhe Nebbiolo, 2022, 1500 ml",RED,,78.00
v.18294.2022.b,"Giovanni Rosso, Langhe Nebbiolo, 2022, 750 ml",RED,,36.00
